{
  "$schema": "https://json-schema.org/draft/2020-12/schema",
  "title": "search_ranking_and_dedup fixture",
  "type": "object",
  "required": [
    "contract_version",
    "suite",
    "case_id",
    "input",
    "expected"
  ],
  "properties": {
    "contract_version": {
      "type": "integer",
      "minimum": 4
    },
    "suite": {
      "const": "search_ranking_and_dedup"
    },
    "case_id": {
      "type": "string",
      "minLength": 1
    },
    "input": {
      "type": "object",
      "required": [
        "results"
      ],
      "properties": {
        "results": {
          "type": "array",
          "items": {
            "type": "object",
            "required": [
              "media_type",
              "id"
            ],
            "properties": {
              "media_type": {
                "type": "string",
                "minLength": 1
              },
              "id": {
                "type": "integer"
              },
              "title": {
                "type": [
                  "string",
                  "null"
                ]
              },
              "name": {
                "type": [
                  "string",
                  "null"
                ]
              },
              "release_date": {
                "type": [
                  "string",
                  "null"
                ]
              },
              "first_air_date": {
                "type": [
                  "string",
                  "null"
                ]
              },
              "poster_path": {
                "type": [
                  "string",
                  "null"
                ]
              },
              "profile_path": {
                "type": [
                  "string",
                  "null"
                ]
              },
              "vote_average": {
                "type": [
                  "number",
                  "null"
                ]
              }
            },
            "additionalProperties": false
          }
        }
      },
      "additionalProperties": false
    },
    "expected": {
      "type": "object",
      "required": [
        "items"
      ],
      "properties": {
        "items": {
          "type": "array",
          "items": {
            "type": "object",
              "required": [
                "media_type",
                "item_key",
                "title"
              ],
              "properties": {
                "media_type": {
                  "type": "string",
                  "enum": [
                    "movie",
                    "series",
                    "show",
                    "person"
                  ]
                },
                "item_key": {
                  "type": "string",
                  "minLength": 1
                },
                "provider": {
                  "type": "string",
                  "minLength": 1
                },
                "provider_id": {
                  "type": "string",
                  "minLength": 1
                },
                "title": {
                  "type": "string",
                "minLength": 1
              },
              "year": {
                "type": [
                  "integer",
                  "null"
                ]
              },
              "image_url": {
                "type": [
                  "string",
                  "null"
                ]
              },
              "rating": {
                "type": [
                  "number",
                  "null"
                ]
              }
            },
            "additionalProperties": false
          }
        }
      },
      "additionalProperties": false
    }
  },
  "additionalProperties": false
}
